8593,mf1wnvoo-z4svs2,no-vote,I support the government in having the authority to enforce vaccine and quarantine measures because we've seen from the last pandemic that the American people are unable to help themselves. Sometimes there needs to be someone to step in and help society as a whole to get through hard times.,2025-09-02T02:04:33.224443+00:00,False,,,,public,,,2025-09-02T02:04:33.192Z,https://app.deliberation.io/participate/020cc470-6a20-487c-b199-c981a6ffa221?PROLIFIC_PID=62f6e81d42e7c4dea045f2fc&STUDY_ID=68b36213d94873f22952dc5b&SESSION_ID=68b6506b427872d45354d475,Page 1: 02:03:31; Page 2: 02:04:29,Do you support the government having the authority to enforce vaccination and quarantine measures during severe epidemics? Please answer briefly in 1–2 sentences.: Visible,I support the government in having the authority to enforce vaccine and quarantine measures because we've seen from the last pandemic that the American people are unable to help themselves. Sometimes there needs to be someone to step in and help society as a whole to get through hard times.,"{""_session_id"": ""mf1wmk02-pqzq9m"", ""_page_visits"": {""0"": ""2025-09-02T02:03:31.520Z"", ""1"": ""2025-09-02T02:04:29.422Z""}, ""_submitted_at"": ""2025-09-02T02:04:33.224070"", ""_module_status"": {""ae448238-cfa7-43f4-8809-6b36c5880c40"": {""id"": ""ae448238-cfa7-43f4-8809-6b36c5880c40"", ""type"": ""text"", ""title"": ""Do you support the government having the authority to enforce vaccination and quarantine measures during severe epidemics? Please answer briefly in 1\u20132 sentences."", ""hasValue"": true, ""isVisible"": true, ""pageIndex"": 0, ""conditions"": [], ""isDisabled"": false, ""isCompleted"": true}}, ""_access_control"": {""type"": ""public"", ""access_granted_at"": ""2025-09-02T02:04:33.192Z""}, ""_participation_url"": ""https://app.deliberation.io/participate/020cc470-6a20-487c-b199-c981a6ffa221?PROLIFIC_PID=62f6e81d42e7c4dea045f2fc&STUDY_ID=68b36213d94873f22952dc5b&SESSION_ID=68b6506b427872d45354d475"", ""_random_condition_results"": {}, ""_randomized_module_orders"": {}, ""ae448238-cfa7-43f4-8809-6b36c5880c40"": ""I support the government in having the authority to enforce vaccine and quarantine measures because we've seen from the last pandemic that the American people are unable to help themselves. Sometimes there needs to be someone to step in and help society as a whole to get through hard times.""}"
8592,mf1wnvrc-buqqnt,no-vote,I believe people should have a say in the matter of vaccinations. People losing their jobs over a vaccine that they could be potentially allergic to/have a bad reaction to. The government should clear what it is those vaccines so people don't get scared to take something they know nothing about.,2025-09-02T02:04:33.116077+00:00,False,,,,public,,,2025-09-02T02:04:33.289Z,https://app.deliberation.io/participate/020cc470-6a20-487c-b199-c981a6ffa221?PROLIFIC_PID=673c90022c553e1b8f60a3af&STUDY_ID=68b36213d94873f22952dc5b&SESSION_ID=68b6502e60701bde6571de2d,Page 1: 02:02:31; Page 2: 02:04:31,Do you support the government having the authority to enforce vaccination and quarantine measures during severe epidemics? Please answer briefly in 1–2 sentences.: Visible,I believe people should have a say in the matter of vaccinations. People losing their jobs over a vaccine that they could be potentially allergic to/have a bad reaction to. The government should clear what it is those vaccines so people don't get scared to take something they know nothing about.,"{""_session_id"": ""mf1wl9qm-dgvhej"", ""_page_visits"": {""0"": ""2025-09-02T02:02:31.520Z"", ""1"": ""2025-09-02T02:04:31.777Z""}, ""_submitted_at"": ""2025-09-02T02:04:33.115712"", ""_module_status"": {""ae448238-cfa7-43f4-8809-6b36c5880c40"": {""id"": ""ae448238-cfa7-43f4-8809-6b36c5880c40"", ""type"": ""text"", ""title"": ""Do you support the government having the authority to enforce vaccination and quarantine measures during severe epidemics? Please answer briefly in 1\u20132 sentences."", ""hasValue"": true, ""isVisible"": true, ""pageIndex"": 0, ""conditions"": [], ""isDisabled"": false, ""isCompleted"": true}}, ""_access_control"": {""type"": ""public"", ""access_granted_at"": ""2025-09-02T02:04:33.289Z""}, ""_participation_url"": ""https://app.deliberation.io/participate/020cc470-6a20-487c-b199-c981a6ffa221?PROLIFIC_PID=673c90022c553e1b8f60a3af&STUDY_ID=68b36213d94873f22952dc5b&SESSION_ID=68b6502e60701bde6571de2d"", ""_random_condition_results"": {}, ""_randomized_module_orders"": {}, ""ae448238-cfa7-43f4-8809-6b36c5880c40"": ""I believe people should have a say in the matter of vaccinations. People losing their jobs over a vaccine that they could be potentially allergic to/have a bad reaction to. The government should clear what it is those vaccines so people don't get scared to take something they know nothing about.""}"
8591,mf1wns7y-o8i23r,no-vote,"I do support it, only in the case of sever epidemics because seeing first hand how many people didn't get vaccinated during COVID, caused COVID to spread even more and caused many unneeded deaths as well as people that were sick and didn't quarantine themselves. I believe people should look out for their fellow citizen, so the government should enforce it, for the greater good of other citizens.",2025-09-02T02:04:31.843271+00:00,False,,,,public,,,2025-09-02T02:04:28.702Z,https://app.deliberation.io/participate/020cc470-6a20-487c-b199-c981a6ffa221?PROLIFIC_PID=5b8d575aafe6be000115695b&STUDY_ID=68b36213d94873f22952dc5b&SESSION_ID=68b64ffd176cbafbd9d12988,Page 1: 02:01:42; Page 2: 02:04:27,Do you support the government having the authority to enforce vaccination and quarantine measures during severe epidemics? Please answer briefly in 1–2 sentences.: Visible,"I do support it, only in the case of sever epidemics because seeing first hand how many people didn't get vaccinated during COVID, caused COVID to spread even more and caused many unneeded deaths as well as people that were sick and didn't quarantine themselves. I believe people should look out for their fellow citizen, so the government should enforce it, for the greater good of other citizens.","{""_session_id"": ""mf1wk7j3-2z1fqx"", ""_page_visits"": {""0"": ""2025-09-02T02:01:42.037Z"", ""1"": ""2025-09-02T02:04:27.713Z""}, ""_submitted_at"": ""2025-09-02T02:04:31.842913"", ""_module_status"": {""ae448238-cfa7-43f4-8809-6b36c5880c40"": {""id"": ""ae448238-cfa7-43f4-8809-6b36c5880c40"", ""type"": ""text"", ""title"": ""Do you support the government having the authority to enforce vaccination and quarantine measures during severe epidemics? Please answer briefly in 1\u20132 sentences."", ""hasValue"": true, ""isVisible"": true, ""pageIndex"": 0, ""conditions"": [], ""isDisabled"": false, ""isCompleted"": true}}, ""_access_control"": {""type"": ""public"", ""access_granted_at"": ""2025-09-02T02:04:28.702Z""}, ""_participation_url"": ""https://app.deliberation.io/participate/020cc470-6a20-487c-b199-c981a6ffa221?PROLIFIC_PID=5b8d575aafe6be000115695b&STUDY_ID=68b36213d94873f22952dc5b&SESSION_ID=68b64ffd176cbafbd9d12988"", ""_random_condition_results"": {}, ""_randomized_module_orders"": {}, ""ae448238-cfa7-43f4-8809-6b36c5880c40"": ""I do support it, only in the case of sever epidemics because seeing first hand how many people didn't get vaccinated during COVID, caused COVID to spread even more and caused many unneeded deaths as well as people that were sick and didn't quarantine themselves. I believe people should look out for their fellow citizen, so the government should enforce it, for the greater good of other citizens.""}"
8583,mf1wndey-y1e1aw,no-vote,"I don't think people should be forced to vaccinate. During the pandemic, some folks lost their jobs because they didn't get vaccinated. Many people who got vaccinated got COVID anyway and transmitted the virus to others. Dems say, ""My body, my choice"" regarding abortion, but that argument isn't acceptable regarding vaccines.",2025-09-02T02:04:09.295556+00:00,False,,,,public,,,2025-09-02T02:04:09.515Z,https://app.deliberation.io/participate/020cc470-6a20-487c-b199-c981a6ffa221?PROLIFIC_PID=6715ae375af67cf364ef48dc&STUDY_ID=68b36213d94873f22952dc5b&SESSION_ID=68b64f5718a210083e8af1c5,Page 1: 01:59:01; Page 2: 02:03:53,Do you support the government having the authority to enforce vaccination and quarantine measures during severe epidemics? Please answer briefly in 1–2 sentences.: Visible,"I don't think people should be forced to vaccinate. During the pandemic, some folks lost their jobs because they didn't get vaccinated. Many people who got vaccinated got COVID anyway and transmitted the virus to others. Dems say, ""My body, my choice"" regarding abortion, but that argument isn't acceptable regarding vaccines.","{""_session_id"": ""mf1wgrlg-lknii4"", ""_page_visits"": {""0"": ""2025-09-02T01:59:01.422Z"", ""1"": ""2025-09-02T02:03:53.288Z""}, ""_submitted_at"": ""2025-09-02T02:04:09.295168"", ""_module_status"": {""ae448238-cfa7-43f4-8809-6b36c5880c40"": {""id"": ""ae448238-cfa7-43f4-8809-6b36c5880c40"", ""type"": ""text"", ""title"": ""Do you support the government having the authority to enforce vaccination and quarantine measures during severe epidemics? Please answer briefly in 1\u20132 sentences."", ""hasValue"": true, ""isVisible"": true, ""pageIndex"": 0, ""conditions"": [], ""isDisabled"": false, ""isCompleted"": true}}, ""_access_control"": {""type"": ""public"", ""access_granted_at"": ""2025-09-02T02:04:09.515Z""}, ""_participation_url"": ""https://app.deliberation.io/participate/020cc470-6a20-487c-b199-c981a6ffa221?PROLIFIC_PID=6715ae375af67cf364ef48dc&STUDY_ID=68b36213d94873f22952dc5b&SESSION_ID=68b64f5718a210083e8af1c5"", ""_random_condition_results"": {}, ""_randomized_module_orders"": {}, ""ae448238-cfa7-43f4-8809-6b36c5880c40"": ""I don't think people should be forced to vaccinate. During the pandemic, some folks lost their jobs because they didn't get vaccinated. Many people who got vaccinated got COVID anyway and transmitted the virus to others. Dems say, \""My body, my choice\"" regarding abortion, but that argument isn't acceptable regarding vaccines.""}"
8581,mf1wn4uz-acbxsd,no-vote,"I do support it. While I sympathize with those who want to maintain bodily autonomy, as I've grown older (and even during the beginning of the pandemic 5 years ago) I recognize that there are certain things that we must do as citizens to maintain a certain social good. and Part of that includes vaccinations and/or quarantine measures to ensure those more vulnerable among us don't get sick and in order to help curtail the contagion. Stop the spread!",2025-09-02T02:03:59.162947+00:00,False,,,,public,,,2025-09-02T02:03:58.427Z,https://app.deliberation.io/participate/020cc470-6a20-487c-b199-c981a6ffa221?PROLIFIC_PID=5e6a34ed08a6ec0a7f75df79&STUDY_ID=68b36213d94873f22952dc5b&SESSION_ID=68b650073c93281aa741a39a,Page 1: 02:01:49; Page 2: 02:03:57,Do you support the government having the authority to enforce vaccination and quarantine measures during severe epidemics? Please answer briefly in 1–2 sentences.: Visible,"I do support it. While I sympathize with those who want to maintain bodily autonomy, as I've grown older (and even during the beginning of the pandemic 5 years ago) I recognize that there are certain things that we must do as citizens to maintain a certain social good. and Part of that includes vaccinations and/or quarantine measures to ensure those more vulnerable among us don't get sick and in order to help curtail the contagion. Stop the spread!","{""_session_id"": ""mf1wkdja-4nyssq"", ""_page_visits"": {""0"": ""2025-09-02T02:01:49.782Z"", ""1"": ""2025-09-02T02:03:57.338Z""}, ""_submitted_at"": ""2025-09-02T02:03:59.162570"", ""_module_status"": {""ae448238-cfa7-43f4-8809-6b36c5880c40"": {""id"": ""ae448238-cfa7-43f4-8809-6b36c5880c40"", ""type"": ""text"", ""title"": ""Do you support the government having the authority to enforce vaccination and quarantine measures during severe epidemics? Please answer briefly in 1\u20132 sentences."", ""hasValue"": true, ""isVisible"": true, ""pageIndex"": 0, ""conditions"": [], ""isDisabled"": false, ""isCompleted"": true}}, ""_access_control"": {""type"": ""public"", ""access_granted_at"": ""2025-09-02T02:03:58.427Z""}, ""_participation_url"": ""https://app.deliberation.io/participate/020cc470-6a20-487c-b199-c981a6ffa221?PROLIFIC_PID=5e6a34ed08a6ec0a7f75df79&STUDY_ID=68b36213d94873f22952dc5b&SESSION_ID=68b650073c93281aa741a39a"", ""_random_condition_results"": {}, ""_randomized_module_orders"": {}, ""ae448238-cfa7-43f4-8809-6b36c5880c40"": ""I do support it. While I sympathize with those who want to maintain bodily autonomy, as I've grown older (and even during the beginning of the pandemic 5 years ago) I recognize that there are certain things that we must do as citizens to maintain a certain social good. and Part of that includes vaccinations and/or quarantine measures to ensure those more vulnerable among us don't get sick and in order to help curtail the contagion. Stop the spread!""}"
8580,mf1wn62n-oi7bo7,no-vote,Yes. I do support the government having ultimate say in health matters when millions of people are at risk. Quarantine's are a must for suppressing the spread of disease and vaccination is the only real way we can fight against them.,2025-09-02T02:03:58.595199+00:00,False,,,,public,,,2025-09-02T02:03:59.999Z,https://app.deliberation.io/participate/020cc470-6a20-487c-b199-c981a6ffa221?PROLIFIC_PID=5dc5995e5d81cd4153e00138&STUDY_ID=68b36213d94873f22952dc5b&SESSION_ID=68b64fd93d390e0de372a65d,Page 1: 02:01:13; Page 2: 02:03:59,Do you support the government having the authority to enforce vaccination and quarantine measures during severe epidemics? Please answer briefly in 1–2 sentences.: Visible,Yes. I do support the government having ultimate say in health matters when millions of people are at risk. Quarantine's are a must for suppressing the spread of disease and vaccination is the only real way we can fight against them.,"{""_session_id"": ""mf1wjlik-1z03y7"", ""_page_visits"": {""0"": ""2025-09-02T02:01:13.543Z"", ""1"": ""2025-09-02T02:03:59.163Z""}, ""_submitted_at"": ""2025-09-02T02:03:58.594846"", ""_module_status"": {""ae448238-cfa7-43f4-8809-6b36c5880c40"": {""id"": ""ae448238-cfa7-43f4-8809-6b36c5880c40"", ""type"": ""text"", ""title"": ""Do you support the government having the authority to enforce vaccination and quarantine measures during severe epidemics? Please answer briefly in 1\u20132 sentences."", ""hasValue"": true, ""isVisible"": true, ""pageIndex"": 0, ""conditions"": [], ""isDisabled"": false, ""isCompleted"": true}}, ""_access_control"": {""type"": ""public"", ""access_granted_at"": ""2025-09-02T02:03:59.999Z""}, ""_participation_url"": ""https://app.deliberation.io/participate/020cc470-6a20-487c-b199-c981a6ffa221?PROLIFIC_PID=5dc5995e5d81cd4153e00138&STUDY_ID=68b36213d94873f22952dc5b&SESSION_ID=68b64fd93d390e0de372a65d"", ""_random_condition_results"": {}, ""_randomized_module_orders"": {}, ""ae448238-cfa7-43f4-8809-6b36c5880c40"": ""Yes. I do support the government having ultimate say in health matters when millions of people are at risk. Quarantine's are a must for suppressing the spread of disease and vaccination is the only real way we can fight against them.""}"
8579,mf1wn57g-tq5mae,no-vote,"Yes, I support it because we cannot trust all of the public to make sensible decisions that keeps the majority of us safe. There are many citizens who need protection, especially children, the elderly, and the immune compromised. It is unfortunate that it takes government policy to enforce these things to do our best to reduce the harm and death toll caused by an epidemic.",2025-09-02T02:03:58.336634+00:00,False,,,,public,,,2025-09-02T02:03:58.876Z,https://app.deliberation.io/participate/020cc470-6a20-487c-b199-c981a6ffa221?PROLIFIC_PID=65a1ffc87be6e728c2c207c9&STUDY_ID=68b36213d94873f22952dc5b&SESSION_ID=68b6504e2716eda5789c5ed7,Page 1: 02:03:01; Page 2: 02:03:58,Do you support the government having the authority to enforce vaccination and quarantine measures during severe epidemics? Please answer briefly in 1–2 sentences.: Visible,"Yes, I support it because we cannot trust all of the public to make sensible decisions that keeps the majority of us safe. There are many citizens who need protection, especially children, the elderly, and the immune compromised. It is unfortunate that it takes government policy to enforce these things to do our best to reduce the harm and death toll caused by an epidemic.","{""_session_id"": ""mf1wlwh4-uzxhdy"", ""_page_visits"": {""0"": ""2025-09-02T02:03:01.006Z"", ""1"": ""2025-09-02T02:03:58.107Z""}, ""_submitted_at"": ""2025-09-02T02:03:58.336102"", ""_module_status"": {""ae448238-cfa7-43f4-8809-6b36c5880c40"": {""id"": ""ae448238-cfa7-43f4-8809-6b36c5880c40"", ""type"": ""text"", ""title"": ""Do you support the government having the authority to enforce vaccination and quarantine measures during severe epidemics? Please answer briefly in 1\u20132 sentences."", ""hasValue"": true, ""isVisible"": true, ""pageIndex"": 0, ""conditions"": [], ""isDisabled"": false, ""isCompleted"": true}}, ""_access_control"": {""type"": ""public"", ""access_granted_at"": ""2025-09-02T02:03:58.876Z""}, ""_participation_url"": ""https://app.deliberation.io/participate/020cc470-6a20-487c-b199-c981a6ffa221?PROLIFIC_PID=65a1ffc87be6e728c2c207c9&STUDY_ID=68b36213d94873f22952dc5b&SESSION_ID=68b6504e2716eda5789c5ed7"", ""_random_condition_results"": {}, ""_randomized_module_orders"": {}, ""ae448238-cfa7-43f4-8809-6b36c5880c40"": ""Yes, I support it because we cannot trust all of the public to make sensible decisions that keeps the majority of us safe. There are many citizens who need protection, especially children, the elderly, and the immune compromised. It is unfortunate that it takes government policy to enforce these things to do our best to reduce the harm and death toll caused by an epidemic.""}"
8570,mf1wmiws-9apvka,no-vote,"I think its important to enforce some kind of policy to make sure everyone is safe and to ensure no more sickness is passed on, but its also important for people to know that it is a choice and its to keep people safe its not mandatory ",2025-09-02T02:03:30.354655+00:00,False,,,,public,,,2025-09-02T02:03:29.981Z,https://app.deliberation.io/participate/020cc470-6a20-487c-b199-c981a6ffa221?PROLIFIC_PID=6116aa8875bdab57cab52804&STUDY_ID=68b36213d94873f22952dc5b&SESSION_ID=68b64fc035f78b5885bd4d23,Page 1: 02:00:42; Page 2: 02:03:28,Do you support the government having the authority to enforce vaccination and quarantine measures during severe epidemics? Please answer briefly in 1–2 sentences.: Visible,"I think its important to enforce some kind of policy to make sure everyone is safe and to ensure no more sickness is passed on, but its also important for people to know that it is a choice and its to keep people safe its not mandatory ","{""_session_id"": ""mf1wixtk-51g98n"", ""_page_visits"": {""0"": ""2025-09-02T02:00:42.871Z"", ""1"": ""2025-09-02T02:03:28.309Z""}, ""_submitted_at"": ""2025-09-02T02:03:30.353915"", ""_module_status"": {""ae448238-cfa7-43f4-8809-6b36c5880c40"": {""id"": ""ae448238-cfa7-43f4-8809-6b36c5880c40"", ""type"": ""text"", ""title"": ""Do you support the government having the authority to enforce vaccination and quarantine measures during severe epidemics? Please answer briefly in 1\u20132 sentences."", ""hasValue"": true, ""isVisible"": true, ""pageIndex"": 0, ""conditions"": [], ""isDisabled"": false, ""isCompleted"": true}}, ""_access_control"": {""type"": ""public"", ""access_granted_at"": ""2025-09-02T02:03:29.981Z""}, ""_participation_url"": ""https://app.deliberation.io/participate/020cc470-6a20-487c-b199-c981a6ffa221?PROLIFIC_PID=6116aa8875bdab57cab52804&STUDY_ID=68b36213d94873f22952dc5b&SESSION_ID=68b64fc035f78b5885bd4d23"", ""_random_condition_results"": {}, ""_randomized_module_orders"": {}, ""ae448238-cfa7-43f4-8809-6b36c5880c40"": ""I think its important to enforce some kind of policy to make sure everyone is safe and to ensure no more sickness is passed on, but its also important for people to know that it is a choice and its to keep people safe its not mandatory ""}"
8563,mf1wls2u-hp229s,no-vote,"Yes I believe so during severe epidemics because it is for the public safety and health.  I do support this, as it should be done regardless.",2025-09-02T02:02:54.896285+00:00,False,,,,public,,,2025-09-02T02:02:55.206Z,https://app.deliberation.io/participate/020cc470-6a20-487c-b199-c981a6ffa221?PROLIFIC_PID=652f405f086383e711da91f8&STUDY_ID=68b36213d94873f22952dc5b&SESSION_ID=68b6502887036edd3df63746,Page 1: 02:02:24; Page 2: 02:02:54,Do you support the government having the authority to enforce vaccination and quarantine measures during severe epidemics? Please answer briefly in 1–2 sentences.: Visible,"Yes I believe so during severe epidemics because it is for the public safety and health.  I do support this, as it should be done regardless.","{""_session_id"": ""mf1wl46y-5lz5ks"", ""_page_visits"": {""0"": ""2025-09-02T02:02:24.324Z"", ""1"": ""2025-09-02T02:02:54.346Z""}, ""_submitted_at"": ""2025-09-02T02:02:54.895957"", ""_module_status"": {""ae448238-cfa7-43f4-8809-6b36c5880c40"": {""id"": ""ae448238-cfa7-43f4-8809-6b36c5880c40"", ""type"": ""text"", ""title"": ""Do you support the government having the authority to enforce vaccination and quarantine measures during severe epidemics? Please answer briefly in 1\u20132 sentences."", ""hasValue"": true, ""isVisible"": true, ""pageIndex"": 0, ""conditions"": [], ""isDisabled"": false, ""isCompleted"": true}}, ""_access_control"": {""type"": ""public"", ""access_granted_at"": ""2025-09-02T02:02:55.206Z""}, ""_participation_url"": ""https://app.deliberation.io/participate/020cc470-6a20-487c-b199-c981a6ffa221?PROLIFIC_PID=652f405f086383e711da91f8&STUDY_ID=68b36213d94873f22952dc5b&SESSION_ID=68b6502887036edd3df63746"", ""_random_condition_results"": {}, ""_randomized_module_orders"": {}, ""ae448238-cfa7-43f4-8809-6b36c5880c40"": ""Yes I believe so during severe epidemics because it is for the public safety and health.  I do support this, as it should be done regardless.""}"
8561,mf1wlob4-pzpudt,no-vote,"Yes. I think that government should enforce vaccination where people are dying due to the epidemic. But that policy should be counter measured by freedom of movement. In other words, we vaccinate so that kids can go to school, people can go about their regular lives. ",2025-09-02T02:02:52.404073+00:00,False,,,,public,,,2025-09-02T02:02:50.321Z,https://app.deliberation.io/participate/020cc470-6a20-487c-b199-c981a6ffa221?PROLIFIC_PID=6682fbc595609e3f88048a53&STUDY_ID=68b36213d94873f22952dc5b&SESSION_ID=68b64f858fbab9b06b629034,Page 1: 02:00:33; Page 2: 02:02:46,Do you support the government having the authority to enforce vaccination and quarantine measures during severe epidemics? Please answer briefly in 1–2 sentences.: Visible,"Yes. I think that government should enforce vaccination where people are dying due to the epidemic. But that policy should be counter measured by freedom of movement. In other words, we vaccinate so that kids can go to school, people can go about their regular lives. ","{""_session_id"": ""mf1wiq9t-93mcsz"", ""_page_visits"": {""0"": ""2025-09-02T02:00:33.047Z"", ""1"": ""2025-09-02T02:02:46.752Z""}, ""_submitted_at"": ""2025-09-02T02:02:52.403724"", ""_module_status"": {""ae448238-cfa7-43f4-8809-6b36c5880c40"": {""id"": ""ae448238-cfa7-43f4-8809-6b36c5880c40"", ""type"": ""text"", ""title"": ""Do you support the government having the authority to enforce vaccination and quarantine measures during severe epidemics? Please answer briefly in 1\u20132 sentences."", ""hasValue"": true, ""isVisible"": true, ""pageIndex"": 0, ""conditions"": [], ""isDisabled"": false, ""isCompleted"": true}}, ""_access_control"": {""type"": ""public"", ""access_granted_at"": ""2025-09-02T02:02:50.321Z""}, ""_participation_url"": ""https://app.deliberation.io/participate/020cc470-6a20-487c-b199-c981a6ffa221?PROLIFIC_PID=6682fbc595609e3f88048a53&STUDY_ID=68b36213d94873f22952dc5b&SESSION_ID=68b64f858fbab9b06b629034"", ""_random_condition_results"": {}, ""_randomized_module_orders"": {}, ""ae448238-cfa7-43f4-8809-6b36c5880c40"": ""Yes. I think that government should enforce vaccination where people are dying due to the epidemic. But that policy should be counter measured by freedom of movement. In other words, we vaccinate so that kids can go to school, people can go about their regular lives. ""}"
