8880,mf1xrpcb-fp7z58,no-vote,"No, I do not think anyone should be forced to get a vaccination. It is our own body.",2025-09-02T02:35:32.708956+00:00,False,,,,public,,,2025-09-02T02:35:31.212Z,https://app.deliberation.io/participate/020cc470-6a20-487c-b199-c981a6ffa221?PROLIFIC_PID=65fb580ab7fbb2d518ee8eaa&STUDY_ID=68b36213d94873f22952dc5b&SESSION_ID=68b657add77f83e39144f0e2,Page 1: 02:34:44; Page 2: 02:35:28,Do you support the government having the authority to enforce vaccination and quarantine measures during severe epidemics? Please answer briefly in 1–2 sentences.: Visible,"No, I do not think anyone should be forced to get a vaccination. It is our own body.","{""_session_id"": ""mf1xqpiy-q0usat"", ""_page_visits"": {""0"": ""2025-09-02T02:34:44.993Z"", ""1"": ""2025-09-02T02:35:28.097Z""}, ""_submitted_at"": ""2025-09-02T02:35:32.708567"", ""_module_status"": {""ae448238-cfa7-43f4-8809-6b36c5880c40"": {""id"": ""ae448238-cfa7-43f4-8809-6b36c5880c40"", ""type"": ""text"", ""title"": ""Do you support the government having the authority to enforce vaccination and quarantine measures during severe epidemics? Please answer briefly in 1\u20132 sentences."", ""hasValue"": true, ""isVisible"": true, ""pageIndex"": 0, ""conditions"": [], ""isDisabled"": false, ""isCompleted"": true}}, ""_access_control"": {""type"": ""public"", ""access_granted_at"": ""2025-09-02T02:35:31.212Z""}, ""_participation_url"": ""https://app.deliberation.io/participate/020cc470-6a20-487c-b199-c981a6ffa221?PROLIFIC_PID=65fb580ab7fbb2d518ee8eaa&STUDY_ID=68b36213d94873f22952dc5b&SESSION_ID=68b657add77f83e39144f0e2"", ""_random_condition_results"": {}, ""_randomized_module_orders"": {}, ""ae448238-cfa7-43f4-8809-6b36c5880c40"": ""No, I do not think anyone should be forced to get a vaccination. It is our own body.""}"
8867,mf1xo2c7-wc9fub,no-vote,"Yes, I support it. In severe epidemics, government authority to enforce vaccination and quarantine is important to protect public health and prevent widespread harm.",2025-09-02T02:32:52.269764+00:00,False,,,,public,,,2025-09-02T02:32:41.431Z,https://app.deliberation.io/participate/020cc470-6a20-487c-b199-c981a6ffa221?PROLIFIC_PID=662aa1095c1c5061a0121a13&STUDY_ID=68b36213d94873f22952dc5b&SESSION_ID=68b6572bae17c15b3e4758c0,Page 1: 02:32:07; Page 2: 02:32:39,Do you support the government having the authority to enforce vaccination and quarantine measures during severe epidemics? Please answer briefly in 1–2 sentences.: Visible,"Yes, I support it. In severe epidemics, government authority to enforce vaccination and quarantine is important to protect public health and prevent widespread harm.","{""_session_id"": ""mf1xnc77-q24pyx"", ""_page_visits"": {""0"": ""2025-09-02T02:32:07.910Z"", ""1"": ""2025-09-02T02:32:39.340Z""}, ""_submitted_at"": ""2025-09-02T02:32:52.269412"", ""_module_status"": {""ae448238-cfa7-43f4-8809-6b36c5880c40"": {""id"": ""ae448238-cfa7-43f4-8809-6b36c5880c40"", ""type"": ""text"", ""title"": ""Do you support the government having the authority to enforce vaccination and quarantine measures during severe epidemics? Please answer briefly in 1\u20132 sentences."", ""hasValue"": true, ""isVisible"": true, ""pageIndex"": 0, ""conditions"": [], ""isDisabled"": false, ""isCompleted"": true}}, ""_access_control"": {""type"": ""public"", ""access_granted_at"": ""2025-09-02T02:32:41.431Z""}, ""_participation_url"": ""https://app.deliberation.io/participate/020cc470-6a20-487c-b199-c981a6ffa221?PROLIFIC_PID=662aa1095c1c5061a0121a13&STUDY_ID=68b36213d94873f22952dc5b&SESSION_ID=68b6572bae17c15b3e4758c0"", ""_random_condition_results"": {}, ""_randomized_module_orders"": {}, ""ae448238-cfa7-43f4-8809-6b36c5880c40"": ""Yes, I support it. In severe epidemics, government authority to enforce vaccination and quarantine is important to protect public health and prevent widespread harm.""}"
8862,mf1xo14u-fu7bl0,no-vote,I only support if the vaccination will be optional. The government shouldn't require or force anyone to take a vaccine. ,2025-09-02T02:32:41.844005+00:00,False,,,,public,,,2025-09-02T02:32:39.870Z,https://app.deliberation.io/participate/020cc470-6a20-487c-b199-c981a6ffa221?PROLIFIC_PID=67e1613d4ddf1135fbb48d52&STUDY_ID=68b36213d94873f22952dc5b&SESSION_ID=68b6559136db3a6d48a3e8aa,Page 1: 02:30:52; Page 2: 02:32:27,Do you support the government having the authority to enforce vaccination and quarantine measures during severe epidemics? Please answer briefly in 1–2 sentences.: Visible,I only support if the vaccination will be optional. The government shouldn't require or force anyone to take a vaccine. ,"{""_session_id"": ""mf1xlq1h-77px40"", ""_page_visits"": {""0"": ""2025-09-02T02:30:52.568Z"", ""1"": ""2025-09-02T02:32:27.391Z""}, ""_submitted_at"": ""2025-09-02T02:32:41.843629"", ""_module_status"": {""ae448238-cfa7-43f4-8809-6b36c5880c40"": {""id"": ""ae448238-cfa7-43f4-8809-6b36c5880c40"", ""type"": ""text"", ""title"": ""Do you support the government having the authority to enforce vaccination and quarantine measures during severe epidemics? Please answer briefly in 1\u20132 sentences."", ""hasValue"": true, ""isVisible"": true, ""pageIndex"": 0, ""conditions"": [], ""isDisabled"": false, ""isCompleted"": true}}, ""_access_control"": {""type"": ""public"", ""access_granted_at"": ""2025-09-02T02:32:39.870Z""}, ""_participation_url"": ""https://app.deliberation.io/participate/020cc470-6a20-487c-b199-c981a6ffa221?PROLIFIC_PID=67e1613d4ddf1135fbb48d52&STUDY_ID=68b36213d94873f22952dc5b&SESSION_ID=68b6559136db3a6d48a3e8aa"", ""_random_condition_results"": {}, ""_randomized_module_orders"": {}, ""ae448238-cfa7-43f4-8809-6b36c5880c40"": ""I only support if the vaccination will be optional. The government shouldn't require or force anyone to take a vaccine. ""}"
8855,mf1xmk9r-w6s98f,no-vote,I do support the government enforcing vaccines and quarantine during severe epidemics because of what happened during covid. I think some people are too stupid and they need to be told to do something so they don't die or risk other people because of their carelessness. ,2025-09-02T02:31:32.352296+00:00,False,,,,public,,,2025-09-02T02:31:31.360Z,https://app.deliberation.io/participate/020cc470-6a20-487c-b199-c981a6ffa221?PROLIFIC_PID=6100ac178a474bfcc555379b&STUDY_ID=68b36213d94873f22952dc5b&SESSION_ID=68b65680de5284624caa95c1,Page 1: 02:29:33; Page 2: 02:31:28,Do you support the government having the authority to enforce vaccination and quarantine measures during severe epidemics? Please answer briefly in 1–2 sentences.: Visible,I do support the government enforcing vaccines and quarantine during severe epidemics because of what happened during covid. I think some people are too stupid and they need to be told to do something so they don't die or risk other people because of their carelessness. ,"{""_session_id"": ""mf1xk1f0-0k78tp"", ""_page_visits"": {""0"": ""2025-09-02T02:29:33.740Z"", ""1"": ""2025-09-02T02:31:28.897Z""}, ""_submitted_at"": ""2025-09-02T02:31:32.351941"", ""_module_status"": {""ae448238-cfa7-43f4-8809-6b36c5880c40"": {""id"": ""ae448238-cfa7-43f4-8809-6b36c5880c40"", ""type"": ""text"", ""title"": ""Do you support the government having the authority to enforce vaccination and quarantine measures during severe epidemics? Please answer briefly in 1\u20132 sentences."", ""hasValue"": true, ""isVisible"": true, ""pageIndex"": 0, ""conditions"": [], ""isDisabled"": false, ""isCompleted"": true}}, ""_access_control"": {""type"": ""public"", ""access_granted_at"": ""2025-09-02T02:31:31.360Z""}, ""_participation_url"": ""https://app.deliberation.io/participate/020cc470-6a20-487c-b199-c981a6ffa221?PROLIFIC_PID=6100ac178a474bfcc555379b&STUDY_ID=68b36213d94873f22952dc5b&SESSION_ID=68b65680de5284624caa95c1"", ""_random_condition_results"": {}, ""_randomized_module_orders"": {}, ""ae448238-cfa7-43f4-8809-6b36c5880c40"": ""I do support the government enforcing vaccines and quarantine during severe epidemics because of what happened during covid. I think some people are too stupid and they need to be told to do something so they don't die or risk other people because of their carelessness. ""}"
8851,mf1xl98x-5y47sd,no-vote,"Yes, I fully support the government having that authority during severe epidemics because their ultimate goal is to keep people safe and healthy. It may not be the most enjoyable situation to be in, but we have a right as citizens to ensure our safety in times of crisis as a collective.",2025-09-02T02:30:30.902514+00:00,False,,,,public,,,2025-09-02T02:30:30.417Z,https://app.deliberation.io/participate/020cc470-6a20-487c-b199-c981a6ffa221?PROLIFIC_PID=5f518c4fb3a4953e4f9f7e18&STUDY_ID=68b36213d94873f22952dc5b&SESSION_ID=68b65625bf5cf97eae96147b,Page 1: 02:27:55; Page 2: 02:30:27,Do you support the government having the authority to enforce vaccination and quarantine measures during severe epidemics? Please answer briefly in 1–2 sentences.: Visible,"Yes, I fully support the government having that authority during severe epidemics because their ultimate goal is to keep people safe and healthy. It may not be the most enjoyable situation to be in, but we have a right as citizens to ensure our safety in times of crisis as a collective.","{""_session_id"": ""mf1xhxmt-qgrvrp"", ""_page_visits"": {""0"": ""2025-09-02T02:27:55.476Z"", ""1"": ""2025-09-02T02:30:27.559Z""}, ""_submitted_at"": ""2025-09-02T02:30:30.902148"", ""_module_status"": {""ae448238-cfa7-43f4-8809-6b36c5880c40"": {""id"": ""ae448238-cfa7-43f4-8809-6b36c5880c40"", ""type"": ""text"", ""title"": ""Do you support the government having the authority to enforce vaccination and quarantine measures during severe epidemics? Please answer briefly in 1\u20132 sentences."", ""hasValue"": true, ""isVisible"": true, ""pageIndex"": 0, ""conditions"": [], ""isDisabled"": false, ""isCompleted"": true}}, ""_access_control"": {""type"": ""public"", ""access_granted_at"": ""2025-09-02T02:30:30.417Z""}, ""_participation_url"": ""https://app.deliberation.io/participate/020cc470-6a20-487c-b199-c981a6ffa221?PROLIFIC_PID=5f518c4fb3a4953e4f9f7e18&STUDY_ID=68b36213d94873f22952dc5b&SESSION_ID=68b65625bf5cf97eae96147b"", ""_random_condition_results"": {}, ""_randomized_module_orders"": {}, ""ae448238-cfa7-43f4-8809-6b36c5880c40"": ""Yes, I fully support the government having that authority during severe epidemics because their ultimate goal is to keep people safe and healthy. It may not be the most enjoyable situation to be in, but we have a right as citizens to ensure our safety in times of crisis as a collective.""}"
8840,mf1xizqq-upmy2p,no-vote,"I do not. Why? Because the US government is not a dictatorship, it has no authority to ""enforce"" these measures even during epidemics.",2025-09-02T02:28:44.316742+00:00,False,,,,public,,,2025-09-02T02:28:44.786Z,https://app.deliberation.io/participate/020cc470-6a20-487c-b199-c981a6ffa221?PROLIFIC_PID=63c5c3192e709e19fc67d5dd&STUDY_ID=68b36213d94873f22952dc5b&SESSION_ID=68b655651e0edb4f468d5667,Page 1: 02:26:44; Page 2: 02:28:39,Do you support the government having the authority to enforce vaccination and quarantine measures during severe epidemics? Please answer briefly in 1–2 sentences.: Visible,"I do not. Why? Because the US government is not a dictatorship, it has no authority to ""enforce"" these measures even during epidemics.","{""_session_id"": ""mf1xgejq-fd0p13"", ""_page_visits"": {""0"": ""2025-09-02T02:26:44.108Z"", ""1"": ""2025-09-02T02:28:39.726Z""}, ""_submitted_at"": ""2025-09-02T02:28:44.316104"", ""_module_status"": {""ae448238-cfa7-43f4-8809-6b36c5880c40"": {""id"": ""ae448238-cfa7-43f4-8809-6b36c5880c40"", ""type"": ""text"", ""title"": ""Do you support the government having the authority to enforce vaccination and quarantine measures during severe epidemics? Please answer briefly in 1\u20132 sentences."", ""hasValue"": true, ""isVisible"": true, ""pageIndex"": 0, ""conditions"": [], ""isDisabled"": false, ""isCompleted"": true}}, ""_access_control"": {""type"": ""public"", ""access_granted_at"": ""2025-09-02T02:28:44.786Z""}, ""_participation_url"": ""https://app.deliberation.io/participate/020cc470-6a20-487c-b199-c981a6ffa221?PROLIFIC_PID=63c5c3192e709e19fc67d5dd&STUDY_ID=68b36213d94873f22952dc5b&SESSION_ID=68b655651e0edb4f468d5667"", ""_random_condition_results"": {}, ""_randomized_module_orders"": {}, ""ae448238-cfa7-43f4-8809-6b36c5880c40"": ""I do not. Why? Because the US government is not a dictatorship, it has no authority to \""enforce\"" these measures even during epidemics.""}"
8834,mf1xhy2k-5vmkib,no-vote,"No, this is because the government ides critical information from the masses which makes them not to be trustworthy.",2025-09-02T02:27:56.498274+00:00,False,,,,public,,,2025-09-02T02:27:55.964Z,https://app.deliberation.io/participate/020cc470-6a20-487c-b199-c981a6ffa221?PROLIFIC_PID=6791a8549ed23cc3997dd33a&STUDY_ID=68b36213d94873f22952dc5b&SESSION_ID=68b655e12c8080f761f6c115,Page 1: 02:26:58; Page 2: 02:27:51,Do you support the government having the authority to enforce vaccination and quarantine measures during severe epidemics? Please answer briefly in 1–2 sentences.: Visible,"No, this is because the government ides critical information from the masses which makes them not to be trustworthy.","{""_session_id"": ""mf1xgpr5-iukyda"", ""_page_visits"": {""0"": ""2025-09-02T02:26:58.647Z"", ""1"": ""2025-09-02T02:27:51.676Z""}, ""_submitted_at"": ""2025-09-02T02:27:56.497924"", ""_module_status"": {""ae448238-cfa7-43f4-8809-6b36c5880c40"": {""id"": ""ae448238-cfa7-43f4-8809-6b36c5880c40"", ""type"": ""text"", ""title"": ""Do you support the government having the authority to enforce vaccination and quarantine measures during severe epidemics? Please answer briefly in 1\u20132 sentences."", ""hasValue"": true, ""isVisible"": true, ""pageIndex"": 0, ""conditions"": [], ""isDisabled"": false, ""isCompleted"": true}}, ""_access_control"": {""type"": ""public"", ""access_granted_at"": ""2025-09-02T02:27:55.964Z""}, ""_participation_url"": ""https://app.deliberation.io/participate/020cc470-6a20-487c-b199-c981a6ffa221?PROLIFIC_PID=6791a8549ed23cc3997dd33a&STUDY_ID=68b36213d94873f22952dc5b&SESSION_ID=68b655e12c8080f761f6c115"", ""_random_condition_results"": {}, ""_randomized_module_orders"": {}, ""ae448238-cfa7-43f4-8809-6b36c5880c40"": ""No, this is because the government ides critical information from the masses which makes them not to be trustworthy.""}"
8827,mf1xg4ab-63vii4,no-vote,yes of course lest we would be sand by now we need authorities in our lives,2025-09-02T02:26:32.957653+00:00,False,,,,public,,,2025-09-02T02:26:30.708Z,https://app.deliberation.io/participate/020cc470-6a20-487c-b199-c981a6ffa221?PROLIFIC_PID=67e99ec5ac9317593a3fd76b&STUDY_ID=68b36213d94873f22952dc5b&SESSION_ID=68b65567415e44620b16ef7a,Page 1: 02:24:53; Page 2: 02:26:29,Do you support the government having the authority to enforce vaccination and quarantine measures during severe epidemics? Please answer briefly in 1–2 sentences.: Visible,yes of course lest we would be sand by now we need authorities in our lives,"{""_session_id"": ""mf1xe10d-o8mvuv"", ""_page_visits"": {""0"": ""2025-09-02T02:24:53.535Z"", ""1"": ""2025-09-02T02:26:29.204Z""}, ""_submitted_at"": ""2025-09-02T02:26:32.956909"", ""_module_status"": {""ae448238-cfa7-43f4-8809-6b36c5880c40"": {""id"": ""ae448238-cfa7-43f4-8809-6b36c5880c40"", ""type"": ""text"", ""title"": ""Do you support the government having the authority to enforce vaccination and quarantine measures during severe epidemics? Please answer briefly in 1\u20132 sentences."", ""hasValue"": true, ""isVisible"": true, ""pageIndex"": 0, ""conditions"": [], ""isDisabled"": false, ""isCompleted"": true}}, ""_access_control"": {""type"": ""public"", ""access_granted_at"": ""2025-09-02T02:26:30.708Z""}, ""_participation_url"": ""https://app.deliberation.io/participate/020cc470-6a20-487c-b199-c981a6ffa221?PROLIFIC_PID=67e99ec5ac9317593a3fd76b&STUDY_ID=68b36213d94873f22952dc5b&SESSION_ID=68b65567415e44620b16ef7a"", ""_random_condition_results"": {}, ""_randomized_module_orders"": {}, ""ae448238-cfa7-43f4-8809-6b36c5880c40"": ""yes of course lest we would be sand by now we need authorities in our lives""}"
8825,mf1xfsyb-lug0xy,no-vote,I fully support the government enforcing vaccination and quarantine measures. I think this ensures everyone's safety at the end of the day.,2025-09-02T02:26:16.517449+00:00,False,,,,public,,,2025-09-02T02:26:16.019Z,https://app.deliberation.io/participate/020cc470-6a20-487c-b199-c981a6ffa221?PROLIFIC_PID=62e048dfdad3b6080f9a0b0c&STUDY_ID=68b36213d94873f22952dc5b&SESSION_ID=68b6556c886fa7fba5f024aa,Page 1: 02:24:51; Page 2: 02:26:15,Do you support the government having the authority to enforce vaccination and quarantine measures during severe epidemics? Please answer briefly in 1–2 sentences.: Visible,I fully support the government enforcing vaccination and quarantine measures. I think this ensures everyone's safety at the end of the day.,"{""_session_id"": ""mf1xdzf8-1u7lt1"", ""_page_visits"": {""0"": ""2025-09-02T02:24:51.195Z"", ""1"": ""2025-09-02T02:26:15.009Z""}, ""_submitted_at"": ""2025-09-02T02:26:16.517071"", ""_module_status"": {""ae448238-cfa7-43f4-8809-6b36c5880c40"": {""id"": ""ae448238-cfa7-43f4-8809-6b36c5880c40"", ""type"": ""text"", ""title"": ""Do you support the government having the authority to enforce vaccination and quarantine measures during severe epidemics? Please answer briefly in 1\u20132 sentences."", ""hasValue"": true, ""isVisible"": true, ""pageIndex"": 0, ""conditions"": [], ""isDisabled"": false, ""isCompleted"": true}}, ""_access_control"": {""type"": ""public"", ""access_granted_at"": ""2025-09-02T02:26:16.019Z""}, ""_participation_url"": ""https://app.deliberation.io/participate/020cc470-6a20-487c-b199-c981a6ffa221?PROLIFIC_PID=62e048dfdad3b6080f9a0b0c&STUDY_ID=68b36213d94873f22952dc5b&SESSION_ID=68b6556c886fa7fba5f024aa"", ""_random_condition_results"": {}, ""_randomized_module_orders"": {}, ""ae448238-cfa7-43f4-8809-6b36c5880c40"": ""I fully support the government enforcing vaccination and quarantine measures. I think this ensures everyone's safety at the end of the day.""}"
8816,mf1xe9ik-hbsllm,no-vote,"No I do not, this is a form of stupid evil satanic and worthless Marxist communist doctrine. ",2025-09-02T02:25:04.228077+00:00,False,,,,public,,,2025-09-02T02:25:04.172Z,https://app.deliberation.io/participate/020cc470-6a20-487c-b199-c981a6ffa221?PROLIFIC_PID=5fefefa4c9707d3516361c9c&STUDY_ID=68b36213d94873f22952dc5b&SESSION_ID=68b65530028eba22bf1dbd3a,Page 1: 02:23:54; Page 2: 02:25:00,Do you support the government having the authority to enforce vaccination and quarantine measures during severe epidemics? Please answer briefly in 1–2 sentences.: Visible,"No I do not, this is a form of stupid evil satanic and worthless Marxist communist doctrine. ","{""_session_id"": ""mf1xcroa-gwg99t"", ""_page_visits"": {""0"": ""2025-09-02T02:23:54.758Z"", ""1"": ""2025-09-02T02:25:00.056Z""}, ""_submitted_at"": ""2025-09-02T02:25:04.227711"", ""_module_status"": {""ae448238-cfa7-43f4-8809-6b36c5880c40"": {""id"": ""ae448238-cfa7-43f4-8809-6b36c5880c40"", ""type"": ""text"", ""title"": ""Do you support the government having the authority to enforce vaccination and quarantine measures during severe epidemics? Please answer briefly in 1\u20132 sentences."", ""hasValue"": true, ""isVisible"": true, ""pageIndex"": 0, ""conditions"": [], ""isDisabled"": false, ""isCompleted"": true}}, ""_access_control"": {""type"": ""public"", ""access_granted_at"": ""2025-09-02T02:25:04.172Z""}, ""_participation_url"": ""https://app.deliberation.io/participate/020cc470-6a20-487c-b199-c981a6ffa221?PROLIFIC_PID=5fefefa4c9707d3516361c9c&STUDY_ID=68b36213d94873f22952dc5b&SESSION_ID=68b65530028eba22bf1dbd3a"", ""_random_condition_results"": {}, ""_randomized_module_orders"": {}, ""ae448238-cfa7-43f4-8809-6b36c5880c40"": ""No I do not, this is a form of stupid evil satanic and worthless Marxist communist doctrine. ""}"
8815,mf1xe1yh-9envdg,no-vote,"Yes, because in severe epidemics, it is important to have sufficient coverage of immunity across the general population to mitigate spread. The government is there to support the greater good of the populace, and I think this falls under that responsibility.",2025-09-02T02:24:54.464069+00:00,False,,,,public,,,2025-09-02T02:24:54.378Z,https://app.deliberation.io/participate/020cc470-6a20-487c-b199-c981a6ffa221?PROLIFIC_PID=676f2ff678d74407b518207d&STUDY_ID=68b36213d94873f22952dc5b&SESSION_ID=68b655287dfa4f81b81dbf5a,Page 1: 02:23:44; Page 2: 02:24:52,Do you support the government having the authority to enforce vaccination and quarantine measures during severe epidemics? Please answer briefly in 1–2 sentences.: Visible,"Yes, because in severe epidemics, it is important to have sufficient coverage of immunity across the general population to mitigate spread. The government is there to support the greater good of the populace, and I think this falls under that responsibility.","{""_session_id"": ""mf1xcjsv-2mixi0"", ""_page_visits"": {""0"": ""2025-09-02T02:23:44.231Z"", ""1"": ""2025-09-02T02:24:52.208Z""}, ""_submitted_at"": ""2025-09-02T02:24:54.463710"", ""_module_status"": {""ae448238-cfa7-43f4-8809-6b36c5880c40"": {""id"": ""ae448238-cfa7-43f4-8809-6b36c5880c40"", ""type"": ""text"", ""title"": ""Do you support the government having the authority to enforce vaccination and quarantine measures during severe epidemics? Please answer briefly in 1\u20132 sentences."", ""hasValue"": true, ""isVisible"": true, ""pageIndex"": 0, ""conditions"": [], ""isDisabled"": false, ""isCompleted"": true}}, ""_access_control"": {""type"": ""public"", ""access_granted_at"": ""2025-09-02T02:24:54.378Z""}, ""_participation_url"": ""https://app.deliberation.io/participate/020cc470-6a20-487c-b199-c981a6ffa221?PROLIFIC_PID=676f2ff678d74407b518207d&STUDY_ID=68b36213d94873f22952dc5b&SESSION_ID=68b655287dfa4f81b81dbf5a"", ""_random_condition_results"": {}, ""_randomized_module_orders"": {}, ""ae448238-cfa7-43f4-8809-6b36c5880c40"": ""Yes, because in severe epidemics, it is important to have sufficient coverage of immunity across the general population to mitigate spread. The government is there to support the greater good of the populace, and I think this falls under that responsibility.""}"
8808,mf1xc0e3-z971sw,no-vote,I think it’s really important for the government to have the power to require vaccinations and quarantine when there’s a serious outbreak. It helps keep everyone safe and stops the disease from spreading too much.,2025-09-02T02:23:19.650630+00:00,False,,,,public,,,2025-09-02T02:23:19.036Z,https://app.deliberation.io/participate/020cc470-6a20-487c-b199-c981a6ffa221?PROLIFIC_PID=67cc96b64c3dc17edc0a4c45&STUDY_ID=68b36213d94873f22952dc5b&SESSION_ID=68b654df3851704b052828d1,Page 1: 02:22:33; Page 2: 02:23:05,Do you support the government having the authority to enforce vaccination and quarantine measures during severe epidemics? Please answer briefly in 1–2 sentences.: Visible,I think it’s really important for the government to have the power to require vaccinations and quarantine when there’s a serious outbreak. It helps keep everyone safe and stops the disease from spreading too much.,"{""_session_id"": ""mf1xb0o6-ad8e1p"", ""_page_visits"": {""0"": ""2025-09-02T02:22:33.101Z"", ""1"": ""2025-09-02T02:23:05.458Z""}, ""_submitted_at"": ""2025-09-02T02:23:19.650254"", ""_module_status"": {""ae448238-cfa7-43f4-8809-6b36c5880c40"": {""id"": ""ae448238-cfa7-43f4-8809-6b36c5880c40"", ""type"": ""text"", ""title"": ""Do you support the government having the authority to enforce vaccination and quarantine measures during severe epidemics? Please answer briefly in 1\u20132 sentences."", ""hasValue"": true, ""isVisible"": true, ""pageIndex"": 0, ""conditions"": [], ""isDisabled"": false, ""isCompleted"": true}}, ""_access_control"": {""type"": ""public"", ""access_granted_at"": ""2025-09-02T02:23:19.036Z""}, ""_participation_url"": ""https://app.deliberation.io/participate/020cc470-6a20-487c-b199-c981a6ffa221?PROLIFIC_PID=67cc96b64c3dc17edc0a4c45&STUDY_ID=68b36213d94873f22952dc5b&SESSION_ID=68b654df3851704b052828d1"", ""_random_condition_results"": {}, ""_randomized_module_orders"": {}, ""ae448238-cfa7-43f4-8809-6b36c5880c40"": ""I think it\u2019s really important for the government to have the power to require vaccinations and quarantine when there\u2019s a serious outbreak. It helps keep everyone safe and stops the disease from spreading too much.""}"
